Scène 2.VIII.,Icikuulwa 2.VIII.
"Cyrano, Le Bret, les cadets, qui se sont attablés à droite et à gauche","Cyrano, Le Bret, abaice abaile ku kulyo na ku kuso"
et auxquels on sert à boire et à manger.,Elyo na bantu bonse balabapeela ifya kulya no kunwa.
CYRANO (saluant d'un air goguenard ceux qui sortent sans oser le saluer):,CYRANO (alelumbanya abantu abafuma ukwabula ukumupaasha):
  Messieurs. . .Messieurs. . .Messieurs. . .,Mwe mfumu... mwe mfumu... mwe mfumu...
"LE BRET (désolé, redescendant, les bras au ciel):","BUTU (Uwaleloosha, aleya panshi, amaboko yakwe yalemoneka):"
  Ah ! dans quels jolis draps.,Ala ififimbulwa fyali ifisuma nga nshi!
CYRANO:,CYRANO:
  Oh ! toi ! tu vas grogner !,Oh! iwe! iwe ukasosa!
LE BRET:,BUTU:
"  Enfin, tu conviendras","Na lyo line, kuti mwacita bwino"
"  Qu'assassiner toujours la chance passagère,","Ukupaya lyonse ishuko lya mpindi,"
  Devient exagéré.,Ala ukucite'fi.
CYRANO:,CYRANO:
"  Hé bien oui, j'exagère !","Ee, nalicusha sana!"
LE BRET (triomphant):,BUKATA (Uwacimfya):
  Ah !,Ah! Bushe ni shani?
CYRANO:,CYRANO:
"  Mais pour le principe, et pour l'exemple aussi,","Lelo pa kutendeka, e lyo na pa kusambilisha,"
  Je trouve qu'il est bon d'exagérer ainsi.,Nalimona ukuti caliba fye bwino ukulalisha ifya kulya.
LE BRET:,BUTU:
"  Si tu laissais un peu ton âme mousquetaire,","Nga mwaleka umweo wenu uuleikala fye bwino,"
  La fortune et la gloire. . .,Ifyuma ne Nkumbu . . .
CYRANO:,CYRANO:
  Et que faudrait-il faire ?,Finshi tufwile ukucita?
"  Chercher un protecteur puissant, prendre un patron,","Ukufwaya uwa kubacingilila, ukusala umukalamba,"
  Et comme un lierre obscur qui circonvient un tronc,Nga ca kuti impongolo ya mu mushili yalikalika
"  Et s'en fait un tuteur en lui léchant l'écorce,",Elyo apanga umulumendo no kumucusha.
  Grimper par ruse au lieu de s'élever par force ?,Bushe kuti mwacita shani pa kuti mulepanga pa nshi?
"  Non, merci. Dédier, comme tous il le font,","Te kuti tuleshibe, ndatasha."
  Des vers aux financiers ? se changer en bouffon,Ukufuma ku mpanga ukuya ku ba ndalama?
"  Dans l'espoir vil de voir, aux lèvres d'un ministre,","Mu citetekelo ca kuti Lesa ali no kutendeka ukubomfya imfumu,"
"  Naître un sourire, enfin, qui ne soit pas sinistre ?",Bushe kuti cawama ukufwalako umwenso uwaba uwabipisha?
"  Non, merci. Déjeuner, chaque jour, d'un crapaud ?",Bushe cila bushiku kuti mwalalya icisabo ca nsimba?
  Avoir un ventre usé par la marche ? une peau,Ukwenda no mubili wauma
"  Qui plus vite, à l'endroit des genoux, devient sale ?",Ni bani abafuma bwangu mu fiko?
  Exécuter des tours de souplesse dorsale ?. . .,Bushe kuti mwabomba ifya kucita pa kuti muleba ne nsansa? . . .
"  Non, merci. D'une main flatter la chèvre au cou","Nshilatasha, mukwai, mukwai, mukwai, mukwai, mukwai, mukwai, mukwai, mukwai, mukwai, mukwai, mukwai, mukwai, mukwai, mukwai, mukwai, mukwai, mukwai, mukwai, mukwai, mukwai, mukwai, mukwai, mukwai, mukwai, mukwai, mukwai, mukwai, mukwai, mukwai, mukwai, mukwai, mukwai, mukwai, mukwai, mukwai, mukwai, mukwai, mukwai, mukwai, mukwai, mukwai, mukwai, mukwai, mukwai, mukwai, mukwai, mukwai, mukwai, mukwai, mukwai, mukwai, mukwai, mukwai, mukwai, mukwai, mukwai, mukwai, mukwai, mukwai, mukwai, mukwai, mukwai, mukwai, mukwai, muk"
"  Cependant que, de l'autre, on arrose le chou,","Lelo, nga ca kuti umuntu atemwa ukuseepa amenshi,"
"  Et, donneur de séné par désir de rhubarbe,","Kabili uufwaya ukufwala ubululu,"
"  Avoir son encensoir, toujours, dans quelque barbe ?",Bushe lyonse alikwata icikowa ca lubuto mu mukoshi?
"  Non, merci ! Se pousser de giron en giron,","Awe, ndatasha, ukulatambaula fye panono panono,"
"  Devenir un petit grand homme dans un rond,","Ukuba umulumendo mu muputule,"
"  Et naviguer, avec des madrigaux pour rames,","Nga baleenda pa bwato, baleenda na mu mafunde ya pali bemba."
  Et dans ses voiles des soupirs de vieilles dames ?,Bushe mu nkupo yakwe mwaliba ukulila kwa banakashi?
"  Non, merci ! Chez le bon éditeur de Sercy","Awe, ndatasha, ku kasesema wa bwino uwaba muli Sercy"
"  Faire éditer ses vers en payant ? Non, merci !",Bushe kuti mwafwaya ukulemba ifyebo fyabo pa kuti muleshibomfya?
  S'aller faire nommer pape par les conciles,Ukufwaya Ukwitwa ukuti Papa pa Cilye
  Que dans des cabarets tiennent des imbéciles ?,Bushe mu cabarets mwaliba abawelewele?
"  Non, merci ! Travailler à se construire un nom",Ukubombela pa kwishiba ishina
"  Sur un sonnet, au lieu d'en faire d'autres ? Non,",Bushe kuti mwabomfya icikonko ku kulanshanya na bambi?
  Merci ! Ne découvrir du talent qu'aux mazettes ?,Bushe kuti mwaishiba fye ifya kucita bwino mu mabala?
"  Être terrorisé par de vagues gazettes,","Ukutiina ifipope fya mpapulo,"
"  Et se dire sans cesse: Oh, pourvu que je sois","Kabili lyonse uletontonkanya ukuti, 'Oh, nga ndi muntu wa musango yu,"
  Dans les petits papiers du Mercure François ?. . .,Mu mabula ya mu Baibolo ayafumine kuli Mercury Francis? . . .
"  Non, merci ! Calculer, avoir peur, être blême,","Te kuti tulesakamana, tatukwete umwenso, tatukwete amano, tatukwete amano."
"  Aimer mieux faire une visite qu'un poème,","Ukufwaya ukutandala ukucila ukutamba ilyashi lya lwimbo,"
"  Rédiger des placets, se faire présenter ?","Bushe kuti mwalemba ifikope, nelyo ukuisokolola?"
"  Non, merci ! non, merci ! non, merci ! Mais. . .chanter,","Awe, natasha, natasha, natasha, natasha, natasha, natasha, natasha, natasha, natasha, natasha, natasha, natasha, natasha, natasha, natasha, natasha, natasha, natasha, natasha, natasha, natasha, natasha, natasha, natasha, natasha, natasha, natasha, natasha, natasha, natasha, natasha, natasha, natasha, natasha, natasha, natasha, natasha, natasha, natasha, natasha, natasha, natasha, natasha, natasha, natasha, natasha, natasha, natasha, natasha, natasha, natasha, natasha, natasha, natasha, natasha, natasha, natasha, natasha, natasha, natasha, natasha, natasha, natasha, natasha, natasha, nat"
"  Rêver, rire, passer, être seul, être libre,","Ukulalota, ukuseka, ukupita, ukuba weka, ukuba umuntungwa,"
"  Avoir l'oeil qui regarde bien, la voix qui vibre,","Amenso yenu yalamona bwino, ishiwi lyenu lilatutuma."
"  Mettre, quand il vous plaît, son feutre de travers,","Nga mulefwaya, mulefwaya ukulamona kwati tamwaishiba bwino."
"  Pour un oui, pour un non, se battre,--ou faire un vers !","Nga ca kuti ufwaya ukwasuka, ninshi ulefwaya ukulwa, nangu ukukaana!"
"  Travailler sans souci de gloire ou de fortune,","Ukubomba ukwabula ukufwaya icilumba nangu indalama,"
"  A tel voyage, auquel on pense, dans la lune !",Ulwendo ulukalamba ulwaya ku mweshi!
"  N'écrire jamais rien qui de soi ne sortît,","Wilalembapo nangu cimo ico taucita,"
"  Et modeste d'ailleurs, se dire: mon petit,","Kabili uuli ne cilumba, alatila, 'We mwana wandi,"
"  Soit satisfait des fleurs, des fruits, même des feuilles,","Kuti mwapokelela ifisabo, ifisabo, nelyo fye amabula."
  Si c'est dans ton jardin à toi que tu les cueilles !,Nga ca kuti mubalaba mu mpanga yenu!
"  Puis, s'il advient d'un peu triompher, par hasard,","Nga ca kuti afilwa ukucimfya,"
"  Ne pas être obligé d'en rien rendre à César,",Kanshi kuti cawama ukuleka ukulipila imfumu Kesalo.
"  Vis-à-vis de soi-même en garder le mérite,","Nga ca kuti umuntu alefwaya ukuipakisha ubumi bwakwe,"
"  Bref, dédaignant d'être le lierre parasite,","Mu nshila imbi, ukuleka ukuba umulwele,"
"  Lors même qu'on n'est pas le chêne ou le tilleul,","Nangu ca kuti tatwaba nge cimuti ca mukunyu nelyo nge cimpusa,"
"  Ne pas monter bien haut, peut-être, mais tout seul !","Nalimo te kuti mufike pa muulu sana, lelo kuti mwaya fye mwe bene!"
LE BRET:,BUTU:
"  Tout seul, soit ! Mais non pas contre tous ! Comment diable","Nga ca kuti ali fye eka, te bonse twingacimfya."
  As-tu donc contracté la manie effroyable,Bushe iwe uli no bulwele bwabipisha?
"  De te faire toujours, partout, des ennemis ?",Bushe lyonse fye mulemona kwati muli na balwani?
CYRANO:,CYRANO:
"  A force de vous voir vous faire des amis,","Pa kumona ifyo mwaleumfwana,"
"  Et rire à ces amis dont vous avez des foules,","Kabili ukuseka ku banenu abo mwalikwata amabumba,"
  D'une bouche empruntée au derrière des poules !,Ukufuma ku kanwa kafuma ku mfishi ya nkoko!
"  J'aime raréfier sur mes pas les saluts,","Nalitemwa ukulumbanya abantu pa makasa yandi,"
  Et m'écrie avec joie: un ennemi de plus !,"""Nomba na imwe mwe balwani bandi, na imwe bene mulebilikisha!"
LE BRET:,BUTU:
  Quelle aberration !,Ala ici calipusanako!
CYRANO:,CYRANO:
"  Eh bien, oui, c'est mon vice.","Ee, e fyo na ine ndi."
  Déplaire est mon plaisir. J'aime qu'on me haïsse.,"Nalitemwa ukuleka ukubomba imilimo, pantu abantu balipata ifyo ncita."
"  Mon cher, si tu savais comme l'on marche mieux","We love, nga walishiba bwino ifya kwenda"
  Sous la pistolétade excitante des yeux !,Mu menso ya bantu abalemona kwati ni bacipeshamano!
"  Comme, sur les pourpoints, font d'amusantes taches",Nga mulebika amano ku fya kusekesha
  Le fiel des envieux et la bave des lâches !,Icisinka ca bacenjela ne cibi ca bacenjela!
"  --Vous, la molle amitié dont vous vous entourez,","- Imwe, aba bwananyina abafuuka,"
"  Ressemble à ces grands cols d'Italie, ajourés","Balemoneka kwati ni balya banakashi aba Italy, abalekele ukubombela Yehova"
"  Et flottants, dans lesquels votre cou s'effémine:",Kabili mu menshi mwalasenda ifyanso fya mulilo.
"  On y est plus à l'aise. . .et de moins haute mine,","Nga tulecita ifi, tuleumfwa bwino sana."
"  Car le front n'ayant pas de maintien ni de loi,","Pantu icinso tacakwata amafunde, kabili tacakwata amafunde."
"  S'abandonne à pencher dans tous les sens. Mais moi,",Alafilwa ukulamona fyonse ifyo alecita.
"  La Haine, chaque jour, me tuyaute et m'apprête",Ubwapata Cila Bushiku Buntuma no Kuleta
  La fraise dont l'empois force à lever la tête;,"Umulungu uo umulwele uulefwaya ukumusenda,"
  Chaque ennemi de plus est un nouveau godron,Umulwani onse uwapya ni mbushi
"  Qui m'ajoute une gêne, et m'ajoute un rayon:","Alalenga naumfwa ububi, alalenga naumfwa ububi."
"  Car, pareille en tous points à la fraise espagnole,","Pantu, nga filya fine caba ku Spain,"
"  La Haine est un carcan, mais c'est une auréole !","Ubwafya bwaba fye kwati ni mpanga, lelo bwaba kwati ni kalenga!"
"LE BRET (après un silence, passant son bras sous le sien):","ILYO baleloosha, baleloosha ukuboko kwabo:"
"  Fais tout haut l'orgueilleux et l'amer, mais, tout bas","Ulecita icilumba no kuicindika, lelo uleicindika"
  Dis-moi tout simplement qu'elle ne t'aime pas !,Ulelanda fye ukuti talakufwaya!
CYRANO (vivement):,CYRANO (Uwa mweo):
  Tais-toi !,Fumyeni!
"  (Depuis un moment, Christian est entré, s'est mêlé aux cadets; ceux-ci","(Pa numa, ba Christian baingile mu ng'anda, balibombene na ba munyinefwe abaice."
  ne lui adressent pas la parole; il a fini par s'asseoir seul à une,bafilwa ukulanda nankwe; pa numa aikala eka ku
