Scène 2.VIII.,Vaatlus 2.VIII.
"Cyrano, Le Bret, les cadets, qui se sont attablés à droite et à gauche","Cyrano, Le Bret, nooremad, kes istuvad paremal ja vasakul"
et auxquels on sert à boire et à manger.,Ja neid teenitakse sööma ja jooma.
CYRANO (saluant d'un air goguenard ceux qui sortent sans oser le saluer):,"CYRANO (tõstab ülestõusmatult ülestõusma neid, kes ei julge teda tervitada):"
  Messieurs. . .Messieurs. . .Messieurs. . .,"Härrased, härrased, härrased, härrased, härrased, härrased, härrased, härrased, härrased, härrased, härrased, härrased, härrased, härrased, härrased, härrased, härrased, härrased, härrased, härrased, härrased, härrased, härrased, härrased, härrased, härrased, härrased, härrased, härrased, härrased, härrased, härrased, härrased, härrased, härrased, härrased, härrased, härrased, härrased, härrased, härrased, härrased, härrased, härrased, härrased, härrased, härrased, härrased, härrased, härras"
"LE BRET (désolé, redescendant, les bras au ciel):","KÄI (vabandus, tagasi, käed taevas):"
  Ah ! dans quels jolis draps.,Millised ilusad laivad.
CYRANO:,CYRANO:
  Oh ! toi ! tu vas grogner !,Sa hakkad kurkuma!
LE BRET:,- See on tõeline.
"  Enfin, tu conviendras",Lõpuks on sul hea.
"  Qu'assassiner toujours la chance passagère,","Et alati tappa mööduvat õnne,"
  Devient exagéré.,See on liiga suur.
CYRANO:,CYRANO:
"  Hé bien oui, j'exagère !","Jah, ma liigutan."
LE BRET (triomphant):,KÕRA (võitleja):
  Ah !,"- Jah, see on nii."
CYRANO:,CYRANO:
"  Mais pour le principe, et pour l'exemple aussi,","Kuid põhimõtteks ja näidiseks,"
  Je trouve qu'il est bon d'exagérer ainsi.,"Ma arvan, et on hea liialdada nii."
LE BRET:,- See on tõeline.
"  Si tu laissais un peu ton âme mousquetaire,","Kui sa saaksid oma musketis vaimu natuke jätta,"
  La fortune et la gloire. . .,Õnne ja rikkus. . . .
CYRANO:,CYRANO:
  Et que faudrait-il faire ?,Ja mida teha?
"  Chercher un protecteur puissant, prendre un patron,","Otsida võimulikku kaitsjat, võtta isand,"
  Et comme un lierre obscur qui circonvient un tronc,"Nagu pimedane liir, mis ümbritses röövi"
"  Et s'en fait un tuteur en lui léchant l'écorce,","Ja ta teeb selle eest hoolitsema, neelab selle kalju,"
  Grimper par ruse au lieu de s'élever par force ?,"Kas mäe tõmmine on võltsus, mitte jõupingutused?"
"  Non, merci. Dédier, comme tous il le font,","Ei, tänan, et pühendada, nagu kõik teevad,"
  Des vers aux financiers ? se changer en bouffon,Kas vanemad on ka rahavahestused?
"  Dans l'espoir vil de voir, aux lèvres d'un ministre,","Loodetavasti nähes, ministrite huuletel,"
"  Naître un sourire, enfin, qui ne soit pas sinistre ?","Kas sa saad naeratada, kes pole paha?"
"  Non, merci. Déjeuner, chaque jour, d'un crapaud ?",Kas sa tahad iga päev lõunasöögi teha?
  Avoir un ventre usé par la marche ? une peau,Kas kõndimisega kõht on ära kulunud?
"  Qui plus vite, à l'endroit des genoux, devient sale ?",Kes põlve asemel kõige kiiremini rippub?
  Exécuter des tours de souplesse dorsale ?. . .,Kas ta suudab käia seljastikku? . . .
"  Non, merci. D'une main flatter la chèvre au cou","Ei, tänan, vaid ühe käega, et küünata kitsast kaelale."
"  Cependant que, de l'autre, on arrose le chou,","Kui aga teisest kastakse kaali,"
"  Et, donneur de séné par désir de rhubarbe,","Ja ta annab rhubarbi soovist rinnad,"
"  Avoir son encensoir, toujours, dans quelque barbe ?",Kas tal on oma põõs ikka kahel?
"  Non, merci ! Se pousser de giron en giron,","Ei, tänan, tõmbame ringi."
"  Devenir un petit grand homme dans un rond,","Sa oled väike suur mees, kes on ringi peal."
"  Et naviguer, avec des madrigaux pour rames,","Ja purjetada, rammide madrogeid,"
  Et dans ses voiles des soupirs de vieilles dames ?,Ja tema veedil on vanade naiste hooletused?
"  Non, merci ! Chez le bon éditeur de Sercy","Ei, tänan, Sercy's õiges raamatutöötajal."
"  Faire éditer ses vers en payant ? Non, merci !","Kas maksma, et tema verme välja kirjutatakse?"
  S'aller faire nommer pape par les conciles,Papeaks nimetada koosolekutel
  Que dans des cabarets tiennent des imbéciles ?,"Kas sa ei tea, et sa oled mingi idioot?"
"  Non, merci ! Travailler à se construire un nom","Ei, tänan, töötan oma nime ehitamiseks."
"  Sur un sonnet, au lieu d'en faire d'autres ? Non,","Ühe sonneeli asemel, et teha teisi?"
  Merci ! Ne découvrir du talent qu'aux mazettes ?,Kas talendi leiate ainult küünaste juures?
"  Être terrorisé par de vagues gazettes,","Olles terroriseeritud ajalehtede poolt,"
"  Et se dire sans cesse: Oh, pourvu que je sois","Ja ma mõtlen pidevalt: ""Oh, kui ma olen"
  Dans les petits papiers du Mercure François ?. . .,"""Merkur Francisuse väikestele paberidele""?"
"  Non, merci ! Calculer, avoir peur, être blême,","Arve, hirm, pettus,"
"  Aimer mieux faire une visite qu'un poème,",Kas ma armastan rohkem külastust kui luuletust?
"  Rédiger des placets, se faire présenter ?","Kas kirjutada plaatid, ennast tutvustada?"
"  Non, merci ! non, merci ! non, merci ! Mais. . .chanter,","Ei, tänan, tänan, tänan, tänan, tänan, tänan, tänan, tänan, tänan, tänan, tänan, tänan, tänan, tänan, tänan, tänan, tänan, tänan, tänan, tänan, tänan, tänan, tänan, tänan, tänan, tänan, tänan, tänan, tänan, tänan, tänan, tänan, tänan, tänan, tänan, tänan, tänan, tänan, tänan, tänan, tänan, tänan, tänan, tänan, tänan, tänan, tänan, tänan, tänan, tänan, tänan, tänan, tänan, tänan, tänan, tänan, tänan, tänan, tänan, tänan, tänan, tänan, tänan, tänan, tänan, tän"
"  Rêver, rire, passer, être seul, être libre,","Unistada, naerda, mööda minna, üksi olla, vaba olla,"
"  Avoir l'oeil qui regarde bien, la voix qui vibre,","Olgu silm, mis näeb hästi, hääl, mis väriseb,"
"  Mettre, quand il vous plaît, son feutre de travers,","Kui tahad, pane oma tunnet ümber,"
"  Pour un oui, pour un non, se battre,--ou faire un vers !","Jah või ei, võitlema või värvi teha!"
"  Travailler sans souci de gloire ou de fortune,","Tööta mitte uhkuseks ega rikkuseks,"
"  A tel voyage, auquel on pense, dans la lune !","Selline reis, mida me mõtleme, kuu juurde!"
"  N'écrire jamais rien qui de soi ne sortît,","Ära kunagi kirjuta midagi, mis ei tule iseendale."
"  Et modeste d'ailleurs, se dire: mon petit,","Ja tagasihoidlik, mõtleb: ""Mu väike,"
"  Soit satisfait des fleurs, des fruits, même des feuilles,","Kas ta on rahul lilledega, puuviljadega, isegi lehtega,"
  Si c'est dans ton jardin à toi que tu les cueilles !,Kui sa oma aedaga neid kogud!
"  Puis, s'il advient d'un peu triompher, par hasard,","Kui ta siis saab veidi võitu,"
"  Ne pas être obligé d'en rien rendre à César,","""Ma ei pea keisrile midagi maksma."
"  Vis-à-vis de soi-même en garder le mérite,","Oma enda vastu, et hoida selle väärikust,"
"  Bref, dédaignant d'être le lierre parasite,","Ühtlasi, halvemalt, et ma olen parasiti lierre,"
"  Lors même qu'on n'est pas le chêne ou le tilleul,","Isegi kui me pole ei puu ega viin,"
"  Ne pas monter bien haut, peut-être, mais tout seul !","Võib-olla mitte väga kõrgele, aga üksi!"
LE BRET:,- See on tõeline.
"  Tout seul, soit ! Mais non pas contre tous ! Comment diable","Võib-olla üksi, aga mitte kõigi vastu."
  As-tu donc contracté la manie effroyable,Kas sa oled saanud hirmulikku maniat?
"  De te faire toujours, partout, des ennemis ?",Kas sa pead alati vaenlasi tegema?
CYRANO:,CYRANO:
"  A force de vous voir vous faire des amis,","Kui ma näen, kuidas te sõpru teete,"
"  Et rire à ces amis dont vous avez des foules,","Ja naera nende sõpradega, kellega sul rahvahulk on,"
  D'une bouche empruntée au derrière des poules !,"Suus, mis on kanade taga!"
"  J'aime raréfier sur mes pas les saluts,","Mulle meeldib oma jalgadega harva tervitada,"
  Et m'écrie avec joie: un ennemi de plus !,Ja helista mulle rõõmuga: veel üks vaenlane!
LE BRET:,- See on tõeline.
  Quelle aberration !,See on väga ebamäärane.
CYRANO:,CYRANO:
"  Eh bien, oui, c'est mon vice.","Noh, jah, see on minu viisik."
  Déplaire est mon plaisir. J'aime qu'on me haïsse.,"Mulle meeldib, kui mind vihkatakse."
"  Mon cher, si tu savais comme l'on marche mieux","Mu kallis, kui sa tead, kuidas käia, siis parem"
  Sous la pistolétade excitante des yeux !,Nägemise põneva silmade all!
"  Comme, sur les pourpoints, font d'amusantes taches","Nagu, et, punktide teha naljakas täid"
  Le fiel des envieux et la bave des lâches !,Rõõmsute haige ja karmsute haige!
"  --Vous, la molle amitié dont vous vous entourez,","Sina, õrn sõber, kes sind ümbritseb,"
"  Ressemble à ces grands cols d'Italie, ajourés","Näib nagu need suured Itaalia kallid, edasi lükatud"
"  Et flottants, dans lesquels votre cou s'effémine:","Ja ujuvad, kus su kaela on hirmul:"
"  On y est plus à l'aise. . .et de moins haute mine,",Me oleme rohkem mugavad.
"  Car le front n'ayant pas de maintien ni de loi,","Sest eesistul pole mingit hooldust ega seadust,"
"  S'abandonne à pencher dans tous les sens. Mais moi,",Ta loobub igasugusest vahele.
"  La Haine, chaque jour, me tuyaute et m'apprête","Vihkamine, iga päev, peksub ja teeb mind valmis"
  La fraise dont l'empois force à lever la tête;,"Prits, mille mürgistus paneb pea üles."
  Chaque ennemi de plus est un nouveau godron,Iga uus vaenlane on uus rööv.
"  Qui m'ajoute une gêne, et m'ajoute un rayon:",Ta lisab mulle häbi ja hirmu.
"  Car, pareille en tous points à la fraise espagnole,","Sest nagu kõikidel asjaoludel on Hispaania marja,"
"  La Haine est un carcan, mais c'est une auréole !","Vihkamine on nagu karkan, aga see on aurel!"
"LE BRET (après un silence, passant son bras sous le sien):","LEBT ( pärast vaikust, läbides oma käsi oma all):"
"  Fais tout haut l'orgueilleux et l'amer, mais, tout bas","Tee uhke ja haige, aga madala"
  Dis-moi tout simplement qu'elle ne t'aime pas !,"Ütle mulle, et ta ei armasta sind!"
CYRANO (vivement):,CYRANO (elama):
  Tais-toi !,- Ole vait!
"  (Depuis un moment, Christian est entré, s'est mêlé aux cadets; ceux-ci","(Alates hetkest, Christian läks sisse, läks juhijatega, need"
  ne lui adressent pas la parole; il a fini par s'asseoir seul à une,"ei rääkinud temaga, ta lõpuks istus üksi ühe"
