Scène 2.VIII.,"Chabwino, malo 2.VIII."
"Cyrano, Le Bret, les cadets, qui se sont attablés à droite et à gauche","Cyrano, Le Bret, ŵana awo ŵakakhala kumalyero na kumazere"
et auxquels on sert à boire et à manger.,Ndipo ŵakumwa na kurya.
CYRANO (saluant d'un air goguenard ceux qui sortent sans oser le saluer):,CYRANO (wakatawuzga na mazgu ghachisisi awo ŵakufuma kwambura kumutawuzga):
  Messieurs. . .Messieurs. . .Messieurs. . .,"Aŵanthu imwe, aŵanthu imwe, aŵanthu imwe, aŵanthu imwe, aŵanthu imwe, aŵanthu imwe, aŵanthu imwe, aŵanthu imwe, aŵanthu imwe, aŵanthu imwe, aŵanthu imwe, aŵanthu imwe, aŵanthu imwe, aŵanthu imwe, aŵanthu imwe, aŵanthu imwe, aŵanthu imwe, aŵanthu imwe, aŵanthu imwe, aŵanthu imwe, aŵanthu imwe, aŵanthu imwe, aŵanthu imwe, aŵanthu imwe, aŵanthu imwe, aŵanthu imwe, aŵanthu imwe, aŵanthu imwe, aŵanthu imwe, aŵanthu imwe, aŵanthu imwe, aŵanthu imwe, aŵanthu imwe, aŵanthu imwe, aŵanthu imwe, aŵanthu imwe, aŵanthu, aŵanthu, aŵanthu, aŵanthu, aŵ"
"LE BRET (désolé, redescendant, les bras au ciel):","(Salimo, kulondezga, mawoko kuchanya):"
  Ah ! dans quels jolis draps.,Mu vyakupimira vyapadera.
CYRANO:,CYRANO:
  Oh ! toi ! tu vas grogner !,"Iwe, ukulira!"
LE BRET:,MUTU:
"  Enfin, tu conviendras","Paumaliro, mukwenera kuchita makora."
"  Qu'assassiner toujours la chance passagère,","Kuti nyengo zose ukakomenge mwaŵi,"
  Devient exagéré.,Kweni sono ni nkhani yikuru chomene.
CYRANO:,CYRANO:
"  Hé bien oui, j'exagère !",Nakuti nkhutemwa yayi kuyowoya nthena.
LE BRET (triomphant):,MUTU WAKUTEMBA:
  Ah !,Kasi vikenda wuli?
CYRANO:,CYRANO:
"  Mais pour le principe, et pour l'exemple aussi,","Kweni pakuyowoya za fundo, na chakuwonerapo,"
  Je trouve qu'il est bon d'exagérer ainsi.,Nkhuwona kuti ntchiwemi chomene kudandawura nthena.
LE BRET:,MUTU:
"  Si tu laissais un peu ton âme mousquetaire,","Usange ungaleka mzimu wako wauswesi,"
  La fortune et la gloire. . .,Usambazi na uchindami . . .
CYRANO:,CYRANO:
  Et que faudrait-il faire ?,Kasi tikwenera kuchita wuli?
"  Chercher un protecteur puissant, prendre un patron,","Kupenja munthu wankhongono wakuvikilira, kutora munthu uyo wakumuvikilira,"
  Et comme un lierre obscur qui circonvient un tronc,Nga ni thete lakudima ilo likung'anamura thete
"  Et s'en fait un tuteur en lui léchant l'écorce,",Ndipo wakujizgora mulinda wake na kumuluma khuni lake.
  Grimper par ruse au lieu de s'élever par force ?,Kasi mukukwera mwamahara m'malo mwa kukwera na nkhongono?
"  Non, merci. Dédier, comme tous il le font,","Kweni nkhupeleka, nga umo ŵanthu ŵanyake ŵakuchitira,"
  Des vers aux financiers ? se changer en bouffon,Kufumira ku vimbundi kuya ku ŵacumali?
"  Dans l'espoir vil de voir, aux lèvres d'un ministre,","Mu chigomezgo cha kuwona, mu milomo ya muteŵeti,"
"  Naître un sourire, enfin, qui ne soit pas sinistre ?",Kasi munthu uyo wakuŵa na mtima wawakawaka wangaseka wuli?
"  Non, merci. Déjeuner, chaque jour, d'un crapaud ?",Kasi mukurya chakurya cha muhanya na zuŵa?
  Avoir un ventre usé par la marche ? une peau,Kuŵa na nthumbo yakuvunda para ukuyenda
"  Qui plus vite, à l'endroit des genoux, devient sale ?",Kasi ni njani uyo wakwamba kuŵa waswesi?
  Exécuter des tours de souplesse dorsale ?. . .,Kasi mukwenera kuchita maseŵero ghakukhozga msana? . . .
"  Non, merci. D'une main flatter la chèvre au cou","Na woko limoza, nkhumulumbani mbuzi mu singo"
"  Cependant que, de l'autre, on arrose le chou,","Kweni para munthu wakuthira kabichi pa chiŵegha chinyake,"
"  Et, donneur de séné par désir de rhubarbe,",Ndipo wakuŵapa nthumbo na kukhumba mbembe.
"  Avoir son encensoir, toujours, dans quelque barbe ?",Kasi nyengo zose wakugura moto wa vyakununkhira mu chinjiko chake?
"  Non, merci ! Se pousser de giron en giron,",Nkhakhumbanga kuti munthu waŵe na chitima.
"  Devenir un petit grand homme dans un rond,","Kuŵa munthu mulara mu gulu,"
"  Et naviguer, avec des madrigaux pour rames,",Ndipo ŵakwenda pa nyanja na maboti gha sitima za mlengalenga.
  Et dans ses voiles des soupirs de vieilles dames ?,Ndipo mu visalu vyake mukaŵa mazgu gha ŵanakazi ŵachekuru?
"  Non, merci ! Chez le bon éditeur de Sercy","Yayi, nkhumuwongani, kwa Sercy, uyo ni mupharazgi muwemi."
"  Faire éditer ses vers en payant ? Non, merci !",Kasi mukukhumba kuti ŵanthu ŵamulemberani malemba?
  S'aller faire nommer pape par les conciles,Kuŵa Mupapa mu Nyumba za Ufumu
  Que dans des cabarets tiennent des imbéciles ?,Kasi mu nyumba za ŵanthu muli ŵanthu ŵambura mahara?
"  Non, merci ! Travailler à se construire un nom",Nkhukhumba kuti niŵe na mbiri yiwemi.
"  Sur un sonnet, au lieu d'en faire d'autres ? Non,",Kasi mulizgenge waka sumu yimoza m'malo mwa kupangaso zinyake?
  Merci ! Ne découvrir du talent qu'aux mazettes ?,Kasi vikulongora kuti munthu wakuwona maluso mu malo gha ŵanthu?
"  Être terrorisé par de vagues gazettes,","Kuŵa na wofi na nyuzipepara za mu charu,"
"  Et se dire sans cesse: Oh, pourvu que je sois","Ndipo nyengo zose ukuyowoya kuti, 'Nadi, usange ningakhala"
  Dans les petits papiers du Mercure François ?. . .,Mu mabuku gha Mercury Francis? . . .
"  Non, merci ! Calculer, avoir peur, être blême,","Kuchita maseŵera, kopa, kuŵa na maghanoghano ghaheni,"
"  Aimer mieux faire une visite qu'un poème,",Nkhutemwa kuluta ku malo ghakupwanthirapo kuluska nkhanira.
"  Rédiger des placets, se faire présenter ?","Kasi mungalemba mapepara, kujipeleka?"
"  Non, merci ! non, merci ! non, merci ! Mais. . .chanter,","Yayi, zikomo, zikomo, zikomo, zikomo, zikomo, zikomo, zikomo, zikomo, zikomo, zikomo, zikomo, zikomo, zikomo, zikomo, zikomo, zikomo, zikomo, zikomo, zikomo, zikomo, zikomo, zikomo, zikomo, zikomo, zikomo, zikomo, zikomo, zikomo, zikomo, zikomo, zikomo, zikomo, zikomo, zikomo, zikomo, zikomo, zikomo, zikomo, zikomo, zikomo, zikomo, zikomo, zikomo, zikomo, zikomo, zikomo, zikomo, zikomo, zikomo, zikomo, zikomo, zikomo, zikomo, zikomo, zikomo, zikomo, zikomo, zikomo, zikomo, zikomo, zikomo, zikomo, zikomo, zikomo, zikomo, zik"
"  Rêver, rire, passer, être seul, être libre,","Kuŵa wambura kukayika, kuseka, kujumpha, kukhala wekha, kuŵa wambura kukayika,"
"  Avoir l'oeil qui regarde bien, la voix qui vibre,","Kuŵa na jiso lakuwona makora, mazgu ghakutenthema,"
"  Mettre, quand il vous plaît, son feutre de travers,","Para mwawona kuti ntchiwemi, muchitenge nthena."
"  Pour un oui, pour un non, se battre,--ou faire un vers !","Para mwayowoya kuti enya, para mwayowoya kuti yayi, lutani, panji chitani nthena!"
"  Travailler sans souci de gloire ou de fortune,",Ŵagwirenge ntchito kwambura kukhumba uchindami panji usambazi.
"  A tel voyage, auquel on pense, dans la lune !",Ulendo wa ku mwezi uwo ukuwoneka nga ni uwu.
"  N'écrire jamais rien qui de soi ne sortît,",Mungalembanga yayi ivyo mukuwona kuti ni vyambura kwenelera.
"  Et modeste d'ailleurs, se dire: mon petit,","Ndipo wakujiyuyura wakujipulika kuti, 'Mwana wane,"
"  Soit satisfait des fleurs, des fruits, même des feuilles,","Wakukondwa na maluŵa, vipambi, panji makuni."
  Si c'est dans ton jardin à toi que tu les cueilles !,"Usange muli na munda winu, mbwenu mukusora."
"  Puis, s'il advient d'un peu triompher, par hasard,","Ndipo usange wangatondapo pachoko waka,"
"  Ne pas être obligé d'en rien rendre à César,",Ntheura nkhukhumba yayi kupeleka kwa Kesare.
"  Vis-à-vis de soi-même en garder le mérite,","Para munthu wakujiwona kuti ngwakwenelera,"
"  Bref, dédaignant d'être le lierre parasite,",Kweni nkhakondwa yayi na ivyo nkhachita.
"  Lors même qu'on n'est pas le chêne ou le tilleul,","Nanga tingaŵa kuti ndise makuni gha khuni la mkuyu yayi,"
"  Ne pas monter bien haut, peut-être, mais tout seul !","Panji tingakwera yayi, kweni tingakwera tekha."
LE BRET:,MUTU:
"  Tout seul, soit ! Mais non pas contre tous ! Comment diable",Kweni ni wose yayi awo ŵakususka.
  As-tu donc contracté la manie effroyable,Kasi iwe ukasangana na suzgo yikuru?
"  De te faire toujours, partout, des ennemis ?",Kasi mukukhumba kuti nyengo zose muŵe na ŵalwani?
CYRANO:,CYRANO:
"  A force de vous voir vous faire des amis,",Chifukwa chakuti mukuŵa paubwezi na ŵanthu ŵanandi.
"  Et rire à ces amis dont vous avez des foules,",Ndipo musekenge ŵabwezi ŵinu awo muli nawo mu mzinda.
  D'une bouche empruntée au derrière des poules !,Na mulomo uwo ukakwera mu nkhuku!
"  J'aime raréfier sur mes pas les saluts,",Nkhutemwa kupokelera ŵanthu pa malundi ghane.
  Et m'écrie avec joie: un ennemi de plus !,"Ndipo ŵanichemerezga mwachimwemwe kuti: ""Mwani munyake!"""
LE BRET:,MUTU:
  Quelle aberration !,Kasi ukuwona wuli?
CYRANO:,CYRANO:
"  Eh bien, oui, c'est mon vice.","Enya, ndine wakwananga."
  Déplaire est mon plaisir. J'aime qu'on me haïsse.,Nkhukondwa chomene para ŵanthu ŵakunitinkha.
"  Mon cher, si tu savais comme l'on marche mieux","Mubali wane, usange ukumanya umo munthu wangendelera makora"
  Sous la pistolétade excitante des yeux !,Mu maso gha ŵanthu ŵanthena aŵa!
"  Comme, sur les pourpoints, font d'amusantes taches","Para munthu wakuchita vinthu vyakusekeska, wakuŵa na maghanoghano ghakwenelera."
  Le fiel des envieux et la bave des lâches !,Kuŵa na njara ya ŵaheni na nthenda ya ŵankhungu.
"  --Vous, la molle amitié dont vous vous entourez,","Imwe, ŵabwezi ŵinu ŵalusungu,"
"  Ressemble à ces grands cols d'Italie, ajourés",Vikuwoneka nga ni vikoko vikuruvikuru vya ku Italy ivyo vikusunkhunyika
"  Et flottants, dans lesquels votre cou s'effémine:","Ndipo ŵakwenda pasi, awo makongono ghinu ghakugolera."
"  On y est plus à l'aise. . .et de moins haute mine,",Tikukhala makora chomene.
"  Car le front n'ayant pas de maintien ni de loi,","Pakuti chisko cha munthu chilije dango panji dango,"
"  S'abandonne à pencher dans tous les sens. Mais moi,",Wakughanaghana kuti wangachita vinthu mwakukhazikika.
"  La Haine, chaque jour, me tuyaute et m'apprête","Zuŵa lililose, chitima chikunipweteka na kunikhozga"
  La fraise dont l'empois force à lever la tête;,Chomeracho chikukwera mutu wake chifukwa cha poizoni.
  Chaque ennemi de plus est un nouveau godron,Mulwani waliyose ni mphumphi yiphya
"  Qui m'ajoute une gêne, et m'ajoute un rayon:","Wakusazgirapo nthimbanizgo pa ine, na kuniphalira suzgo."
"  Car, pareille en tous points à la fraise espagnole,","Pakuti nga ni mbatata ya ku Spain,"
"  La Haine est un carcan, mais c'est une auréole !","Kutinkha ni nyama, kweni ni chisi!"
"LE BRET (après un silence, passant son bras sous le sien):","MUTU WAKUTI: ""Pakuti wakukhala chete,"
"  Fais tout haut l'orgueilleux et l'amer, mais, tout bas","Ŵakujikuzga ŵajikuzge na kuŵakwiyiska, kweni ŵajiyuyurenge"
  Dis-moi tout simplement qu'elle ne t'aime pas !,Niphalirani waka kuti wakumutemwani yayi.
CYRANO (vivement):,CYRANO (uyo ngwamoyo):
  Tais-toi !,Muŵe chete!
"  (Depuis un moment, Christian est entré, s'est mêlé aux cadets; ceux-ci","(Kufuma apo, Christian wakanjira, wakajipenja na ŵana."
  ne lui adressent pas la parole; il a fini par s'asseoir seul à une,"Kweni wakaleka kuyowoya nayo, ndipo wakakhala yekha pa nyumba yake."
