Scène 2.VIII.,Bước 2.VIII.
"Cyrano, Le Bret, les cadets, qui se sont attablés à droite et à gauche","Cyrano, Le Bret, những đứa trẻ, những người ngồi bên phải và bên trái"
et auxquels on sert à boire et à manger.,Và chúng được phục vụ để ăn uống.
CYRANO (saluant d'un air goguenard ceux qui sortent sans oser le saluer):,CYRANO (của những người ra ngoài mà không dám chào):
  Messieurs. . .Messieurs. . .Messieurs. . .,"Các quý vị, các quý vị, các quý vị."
"LE BRET (désolé, redescendant, les bras au ciel):","BROET (sầu lòng, xuống, cánh tay lên trời):"
  Ah ! dans quels jolis draps.,"Oh, cái tấm vải đẹp thế nào."
CYRANO:,CYRANO:
  Oh ! toi ! tu vas grogner !,"Ôi, mày sẽ sầm sầm!"
LE BRET:,BN:
"  Enfin, tu conviendras","Cuối cùng, em sẽ thích."
"  Qu'assassiner toujours la chance passagère,","Và luôn giết chết may mắn qua thời gian,"
  Devient exagéré.,- Tôi nghĩ là quá mức.
CYRANO:,CYRANO:
"  Hé bien oui, j'exagère !","Vâng, tôi nói quá!"
LE BRET (triomphant):,BN (các người chiến thắng):
  Ah !,À!
CYRANO:,CYRANO:
"  Mais pour le principe, et pour l'exemple aussi,","Nhưng về nguyên tắc, và về ví dụ,"
  Je trouve qu'il est bon d'exagérer ainsi.,Tôi nghĩ rằng việc làm quá mức như thế là tốt.
LE BRET:,BN:
"  Si tu laissais un peu ton âme mousquetaire,","Nếu anh chỉ để một chút linh hồn của anh lại,"
  La fortune et la gloire. . .,Sự giàu có và danh vọng. . . .
CYRANO:,CYRANO:
  Et que faudrait-il faire ?,Vậy phải làm gì?
"  Chercher un protecteur puissant, prendre un patron,","Tìm kiếm một người bảo vệ mạnh mẽ, chọn một người chủ,"
  Et comme un lierre obscur qui circonvient un tronc,Và như một cái sợi đen quấn quanh một cái thân cây
"  Et s'en fait un tuteur en lui léchant l'écorce,","Và nó làm cho mình một người chăm sóc nó bằng cách nhai da nó,"
  Grimper par ruse au lieu de s'élever par force ?,Đi lên bằng cách lố bịch thay vì đi lên bằng sức mạnh?
"  Non, merci. Dédier, comme tous il le font,","Không, cảm ơn."
  Des vers aux financiers ? se changer en bouffon,"Từ những con sâu đến những người tài chính, trở thành những kẻ xấu."
"  Dans l'espoir vil de voir, aux lèvres d'un ministre,","Trong hy vọng khiêm tốn để thấy, từ miệng một bộ trưởng,"
"  Naître un sourire, enfin, qui ne soit pas sinistre ?","Và cũng có thể tạo ra một nụ cười, một nụ cười không có vẻ xấu xa?"
"  Non, merci. Déjeuner, chaque jour, d'un crapaud ?","Không, cảm ơn, ăn trưa mỗi ngày với một con bọ?"
  Avoir un ventre usé par la marche ? une peau,"Có bụng bị mòn khi đi bộ, da"
"  Qui plus vite, à l'endroit des genoux, devient sale ?","Ai nhanh hơn, thay vì đầu gối, trở nên bẩn hơn?"
  Exécuter des tours de souplesse dorsale ?. . .,Làm việc linh hoạt lưng? . . .
"  Non, merci. D'une main flatter la chèvre au cou","Không, cảm ơn, chỉ một tay thôi, ngợi khen con dê."
"  Cependant que, de l'autre, on arrose le chou,","Nhưng nếu người ta cho nước cà phê,"
"  Et, donneur de séné par désir de rhubarbe,","Và người làm cho bé ngực ngực vì ước muốn rhubarb,"
"  Avoir son encensoir, toujours, dans quelque barbe ?",Có phải là lúc nào cũng có lò đốt trong một bộ râu nào đó?
"  Non, merci ! Se pousser de giron en giron,","Không, cảm ơn anh, đi từ đầu đến cuối,"
"  Devenir un petit grand homme dans un rond,","Trở thành một người đàn ông nhỏ lớn trong vòng,"
"  Et naviguer, avec des madrigaux pour rames,","Và đi thuyền với những chiếc tàu đệm,"
  Et dans ses voiles des soupirs de vieilles dames ?,Và trong những chiếc gác của nó có những tiếng thở dài của những người phụ nữ già?
"  Non, merci ! Chez le bon éditeur de Sercy","Không, cảm ơn anh, tôi đến với nhà xuất bản của Sercy."
"  Faire éditer ses vers en payant ? Non, merci !",Để người ta chỉnh sửa bài viết của mình bằng cách trả tiền?
  S'aller faire nommer pape par les conciles,Đi được các hội đồng thành giáo hoàng
  Que dans des cabarets tiennent des imbéciles ?,Có ai trong các quán ăn có những kẻ ngốc nghếch không?
"  Non, merci ! Travailler à se construire un nom","Không, cảm ơn, làm việc để xây dựng một cái tên"
"  Sur un sonnet, au lieu d'en faire d'autres ? Non,","- Trong một bản sonnet, thay vì làm những bản sonnet khác?"
  Merci ! Ne découvrir du talent qu'aux mazettes ?,"Cảm ơn, chỉ có thể tìm ra tài năng trong những cái lều hả?"
"  Être terrorisé par de vagues gazettes,","Được sợ hãi bởi những tờ báo vẫy,"
"  Et se dire sans cesse: Oh, pourvu que je sois","Và cứ nghĩ rằng: ""Ồ, nếu tôi là"
  Dans les petits papiers du Mercure François ?. . .,Trong những tờ giấy nhỏ của ông Francis Mercury? . . .
"  Non, merci ! Calculer, avoir peur, être blême,","Không, cảm ơn!"
"  Aimer mieux faire une visite qu'un poème,",Thích đến thăm hơn là một bài thơ.
"  Rédiger des placets, se faire présenter ?","Làm những bài viết, tự giới thiệu mình?"
"  Non, merci ! non, merci ! non, merci ! Mais. . .chanter,","Không, cảm ơn, không, cảm ơn, không, cảm ơn, nhưng..."
"  Rêver, rire, passer, être seul, être libre,","Mơ mơ, cười, đi qua, một mình, tự do,"
"  Avoir l'oeil qui regarde bien, la voix qui vibre,","Có mắt nhìn rõ ràng, tiếng nói rung động,"
"  Mettre, quand il vous plaît, son feutre de travers,","Hãy đặt, bất cứ khi nào bạn muốn, cảm giác của mình sai,"
"  Pour un oui, pour un non, se battre,--ou faire un vers !","Để có một ""vâng"", để có một ""không"", chiến đấu, - hoặc làm một con giun!"
"  Travailler sans souci de gloire ou de fortune,",Làm việc không cần sự tôn vinh hay sự giàu có
"  A tel voyage, auquel on pense, dans la lune !","Một chuyến đi như thế nào mà chúng ta nghĩ đến, đến mặt trăng!"
"  N'écrire jamais rien qui de soi ne sortît,","Đừng bao giờ viết bất cứ điều gì mà không xuất phát từ bản thân,"
"  Et modeste d'ailleurs, se dire: mon petit,","Và khiêm tốn, tự nhủ: ""Con trai của tôi,"
"  Soit satisfait des fleurs, des fruits, même des feuilles,","Có thể nó được thỏa mãn với hoa, trái cây, thậm chí là lá,"
  Si c'est dans ton jardin à toi que tu les cueilles !,Nếu là trong vườn của bạn mà bạn lấy chúng!
"  Puis, s'il advient d'un peu triompher, par hasard,","Và nếu hắn có một chút thắng lợi,"
"  Ne pas être obligé d'en rien rendre à César,","""Đừng phải trả tiền cho Hoàng đế,"
"  Vis-à-vis de soi-même en garder le mérite,","Đối với bản thân mình, giữ được sự xứng đáng của nó,"
"  Bref, dédaignant d'être le lierre parasite,","Nói cách khác, không hề coi trọng mình là con chó lợn lợn lợn lợn lợn,"
"  Lors même qu'on n'est pas le chêne ou le tilleul,","Ngay cả khi chúng ta không phải là cây chênh hay cây sồi,"
"  Ne pas monter bien haut, peut-être, mais tout seul !","Không lên cao lắm, nhưng có thể là một mình!"
LE BRET:,BN:
"  Tout seul, soit ! Mais non pas contre tous ! Comment diable","Chỉ riêng mình, nhưng không phải với tất cả mọi người."
  As-tu donc contracté la manie effroyable,Vậy anh có bị mê hoặc không?
"  De te faire toujours, partout, des ennemis ?",Làm cho mình luôn luôn là kẻ thù ở khắp mọi nơi?
CYRANO:,CYRANO:
"  A force de vous voir vous faire des amis,","Vì thấy các bạn kết bạn,"
"  Et rire à ces amis dont vous avez des foules,","Và cười với những người bạn mà bạn có đám đông,"
  D'une bouche empruntée au derrière des poules !,Một cái miệng mà tôi đã lấy từ đằng sau gà!
"  J'aime raréfier sur mes pas les saluts,",Tôi thích nói lời chào khi bước chân.
  Et m'écrie avec joie: un ennemi de plus !,Và kêu lên với tôi: Một kẻ thù nữa!
LE BRET:,BN:
  Quelle aberration !,Thật là một sự kỳ quặc!
CYRANO:,CYRANO:
"  Eh bien, oui, c'est mon vice.","Ừ, đúng là, đó là thói quen của tôi."
  Déplaire est mon plaisir. J'aime qu'on me haïsse.,Tôi thích bị ghét.
"  Mon cher, si tu savais comme l'on marche mieux","Con yêu, nếu con biết cách đi bộ tốt hơn"
  Sous la pistolétade excitante des yeux !,Trong cái nhìn đầy thú vị của đôi mắt!
"  Comme, sur les pourpoints, font d'amusantes taches","Như, trên các điểm, làm những điểm vui vẻ"
  Le fiel des envieux et la bave des lâches !,Sự hận thù của kẻ ghen tuông và sự hận thù của kẻ hèn nhát!
"  --Vous, la molle amitié dont vous vous entourez,","- Anh, bạn thân thân yêu của anh,"
"  Ressemble à ces grands cols d'Italie, ajourés","Giống như những cái cổ lớn của Ý, bị trì hoãn"
"  Et flottants, dans lesquels votre cou s'effémine:","Và những con lượn, trong đó cổ của bạn bị sập."
"  On y est plus à l'aise. . .et de moins haute mine,","Chúng ta thoải mái hơn. Và với mực thấp hơn,"
"  Car le front n'ayant pas de maintien ni de loi,","Vì mặt mặt không có luật pháp,"
"  S'abandonne à pencher dans tous les sens. Mais moi,",Anh ấy cứ ngã ngã theo mọi hướng.
"  La Haine, chaque jour, me tuyaute et m'apprête","Hận thù, mỗi ngày, cứ chọc chọc và làm tôi sắp chết"
  La fraise dont l'empois force à lever la tête;,Cây tây mà chất độc buộc phải nâng đầu lên;
  Chaque ennemi de plus est un nouveau godron,Mỗi kẻ thù khác là một con lợn mới
"  Qui m'ajoute une gêne, et m'ajoute un rayon:","Ngài làm cho tôi thêm sự khó khăn, và làm cho tôi thêm sự sốc."
"  Car, pareille en tous points à la fraise espagnole,","Vì, như tất cả các khía cạnh của cây tây Tây Ban Nha,"
"  La Haine est un carcan, mais c'est une auréole !","Hận thù là một con rồng, nhưng nó là một con rồng!"
"LE BRET (après un silence, passant son bras sous le sien):","BROET (sau một sự im lặng, di chuyển cánh tay của mình dưới của mình):"
"  Fais tout haut l'orgueilleux et l'amer, mais, tout bas","Hãy làm cho người kiêu ngạo cao và cay đắng, nhưng thấp kém"
  Dis-moi tout simplement qu'elle ne t'aime pas !,Chỉ cần nói với tôi rằng cô ấy không yêu anh!
CYRANO (vivement):,CYRANO (sống):
  Tais-toi !,- Đừng nói gì!
"  (Depuis un moment, Christian est entré, s'est mêlé aux cadets; ceux-ci","(Trong một thời gian, Christian đã vào, tham gia vào các trẻ em; những người này"
  ne lui adressent pas la parole; il a fini par s'asseoir seul à une,không nói chuyện với ông ta; cuối cùng ông ta ngồi một mình với một
