Scène 2.VIII.,Sénégal 2.VIII.
"Cyrano, Le Bret, les cadets, qui se sont attablés à droite et à gauche","Cyrano, Le Bret, ndaw yi, ñu toog ci ndeyjoor ak càmmooñ"
et auxquels on sert à boire et à manger.,"te ñu di leen di jaamu, di leen di naan."
CYRANO (saluant d'un air goguenard ceux qui sortent sans oser le saluer):,CYRANO (yëgël na ñi génn te bañ a ko salu):
  Messieurs. . .Messieurs. . .Messieurs. . .,Sëriñ yi. Sëriñ yi.
"LE BRET (désolé, redescendant, les bras au ciel):","BIR (Xooy, di wàcc, ay loxoy ci asamaan):"
  Ah ! dans quels jolis draps.,Aah! ci li ñu gis ci biir.
CYRANO:,CYRANO:
  Oh ! toi ! tu vas grogner !,"Yaw, dinga xeex!"
LE BRET:,BÉY:
"  Enfin, tu conviendras","Ci lu ëpp, dinga gëna"
"  Qu'assassiner toujours la chance passagère,","Lu tax ñu di rey lu dul yàgg,"
  Devient exagéré.,Mooy na lu bare.
CYRANO:,CYRANO:
"  Hé bien oui, j'exagère !","Waaw, man naa di jàppe."
LE BRET (triomphant):,BÉY (Béy)
  Ah !,Ah !
CYRANO:,CYRANO:
"  Mais pour le principe, et pour l'exemple aussi,","Waaye ci ndaje bi, ci misaal bi itam,"
  Je trouve qu'il est bon d'exagérer ainsi.,"Maa ngi xalaat ne, lu baax la, mooy di gën a màgg."
LE BRET:,BÉY:
"  Si tu laissais un peu ton âme mousquetaire,","Su fekkee ne, su fekkee ne, sa xol bu mujj,"
  La fortune et la gloire. . .,"Jigéen yi, seen alal ak seen ndam. . . ."
CYRANO:,CYRANO:
  Et que faudrait-il faire ?,Lan la ñu war a def?
"  Chercher un protecteur puissant, prendre un patron,","Xamal boroom doole, nangu boroom doole,"
  Et comme un lierre obscur qui circonvient un tronc,Ni xëtu xëtu xëtu xëtu xëtu xëtu xëtu xëtu xëtu xëtu xëtu xëtu xëtu xëtu xëtu xëtu xëtu xëtu xëtu xëtu xëtu xëtu xëtu xëtu xëtu xëtu xëtu xëtu xëtu xëtu xëtu xëtu xëtu xëtu xëtu xëtu xëtu xëtu xëtu xëtu xëtu xëtu xëtu xëtu xëtu xëtu xëtu xëtu xëtu xëtu xëtu xëtu xëtu xëtu xëtu xëtu xëtu xëtu xëtu xëtu xëtu xëtu xëtu xëtu xëtu xë
"  Et s'en fait un tuteur en lui léchant l'écorce,","Mu def ko boroom, di ko xeex, di ko xeex."
  Grimper par ruse au lieu de s'élever par force ?,"Ndax di jàppe ci njàngle, waaye di ko jàppe ci doole?"
"  Non, merci. Dédier, comme tous il le font,","Du, thanks. Dedeer, ni ñu ñépp def,"
  Des vers aux financiers ? se changer en bouffon,"Ci wormi yi, ci ay fànn-nëm yi, di di di di di di di di di di di di di di di di di di di di di di di di di di di di di di di di di di di di di di di di di di di di di di di di di di di di di di di di di di di di di di di di di di di di di di di di di di di di di di di di di di di di di di di di di di di di di di di di di di di di di di di di di di di di di di di di di di di di di di di di di di di di di di di di di di di di di di di di di di di di di di di di di di di di di di di di di di di di di di di di di di di di di di di di di di di di di di di di di di di di di di di"
"  Dans l'espoir vil de voir, aux lèvres d'un ministre,","Ci yaakaar bu néew doole, gis, ci kàdduy boroom réew,"
"  Naître un sourire, enfin, qui ne soit pas sinistre ?","Ndax mën a am gàmm, ba bañ a xëy?"
"  Non, merci. Déjeuner, chaque jour, d'un crapaud ?","Ndax bés bu nekk, di lekk ci biir ci mbaam?"
  Avoir un ventre usé par la marche ? une peau,"Ba ñu di jëmm ci biir, di dox, di gànnaaw"
"  Qui plus vite, à l'endroit des genoux, devient sale ?","Ku gën a mujj, ci biir seen tuur, mu nekk ci biir suuf."
  Exécuter des tours de souplesse dorsale ?. . .,Ndax di jëfe ay jokkoo yuy gën a luy wàcc? . . .
"  Non, merci. D'une main flatter la chèvre au cou","Du, takk, ci benn loxo la, di xamal reem bi ci gànnaawam"
"  Cependant que, de l'autre, on arrose le chou,","Waaye, bu ñu daal ca kaw,"
"  Et, donneur de séné par désir de rhubarbe,","Te mu ngi di jël ay xëtu,"
"  Avoir son encensoir, toujours, dans quelque barbe ?",Ndax am na ko ci biir xarab?
"  Non, merci ! Se pousser de giron en giron,","Du, takk naa la."
"  Devenir un petit grand homme dans un rond,","Di nekk góor bu mag bu ndaw ci benn xët,"
"  Et naviguer, avec des madrigaux pour rames,","te di jaamu, ak ay xànq yu ñu leen di jël,"
  Et dans ses voiles des soupirs de vieilles dames ?,"Te ci seen sàqkat yi, ay jabar yu góor di wax?"
"  Non, merci ! Chez le bon éditeur de Sercy","Du, takk naa la, ci boroom Sercy bu baax bi."
"  Faire éditer ses vers en payant ? Non, merci !",Ndax dinaa leen di fexe ay xëtam ci seen taxawaay?
  S'aller faire nommer pape par les conciles,Ba ñu doon di doon di doon di doon papa ci àttekat yi
  Que dans des cabarets tiennent des imbéciles ?,"Ndax ci biir biir kër yi, ay xarit ñoo koy sàmm?"
"  Non, merci ! Travailler à se construire un nom",Dangeen liggéey ngir am ay tur
"  Sur un sonnet, au lieu d'en faire d'autres ? Non,","Ci benn sonnet, ba bañ a def yeneen?"
  Merci ! Ne découvrir du talent qu'aux mazettes ?,"Yéen, ndax ci biir ay xëtu yi rekk la ngeen gis ay xëtu?"
"  Être terrorisé par de vagues gazettes,","Te ñu ragal xarit yi,"
"  Et se dire sans cesse: Oh, pourvu que je sois","Te di ne sa bopp: ""Soo ma nekk,"
  Dans les petits papiers du Mercure François ?. . .,Ci téere yi ñu doon sàkku ci mercuur François . . .
"  Non, merci ! Calculer, avoir peur, être blême,","Du, takk naa la."
"  Aimer mieux faire une visite qu'un poème,","Bëgg na gën a gis gis gis-gisu,"
"  Rédiger des placets, se faire présenter ?","Di def ay téereb, di ko koy xamal?"
"  Non, merci ! non, merci ! non, merci ! Mais. . .chanter,","Du, takk naa la, du, takk naa la, waaye..."
"  Rêver, rire, passer, être seul, être libre,","Xam, xemm, jàll, nekk ci moom, nekk ci friiru,"
"  Avoir l'oeil qui regarde bien, la voix qui vibre,","Xët bu baax, baat bu rafet,"
"  Mettre, quand il vous plaît, son feutre de travers,","Te su ko neex, di ko fexe."
"  Pour un oui, pour un non, se battre,--ou faire un vers !","Ci yiw, ci neen, di xare, walla di def ay worm!"
"  Travailler sans souci de gloire ou de fortune,","Jëfleen liggéey bu dul njariñ mbaa alal,"
"  A tel voyage, auquel on pense, dans la lune !","Ci biir biir biir weer la, ba ngay xalaat."
"  N'écrire jamais rien qui de soi ne sortît,","Buleen bind dara lu dul lu leen di topp,"
"  Et modeste d'ailleurs, se dire: mon petit,","Te itam, ci lu jëm ci sa bopp, nga ne: ""Sama doom,"
"  Soit satisfait des fleurs, des fruits, même des feuilles,","Te mu lekk ay xale, ay jëmm, sax ay xëtu,"
  Si c'est dans ton jardin à toi que tu les cueilles !,Su fekkee ne ci sa garab la nga koy jël.
"  Puis, s'il advient d'un peu triompher, par hasard,","Su ko defee su ko defee mu am lu am solo,"
"  Ne pas être obligé d'en rien rendre à César,","Te nag nag, bu leen di war a fey ci Seesaar,"
"  Vis-à-vis de soi-même en garder le mérite,","Te ci boppam, nga am na lu baax."
"  Bref, dédaignant d'être le lierre parasite,","Ci lu ëpp, di bañ a nekk lierre yi,"
"  Lors même qu'on n'est pas le chêne ou le tilleul,","Ba nu dul garab ak garab,"
"  Ne pas monter bien haut, peut-être, mais tout seul !","Duñu dugge, waaye moom rekk!"
LE BRET:,BÉY:
"  Tout seul, soit ! Mais non pas contre tous ! Comment diable","Ci boppam, waaye du ci ñépp."
  As-tu donc contracté la manie effroyable,Ndax nga am na njàqare wu réy?
"  De te faire toujours, partout, des ennemis ?",Ndax di ko defal seen noon?
CYRANO:,CYRANO:
"  A force de vous voir vous faire des amis,","Ndax gis ngeen di am ay xarit,"
"  Et rire à ces amis dont vous avez des foules,","Te di gàddaay ay xarit yi nga am ay mbooloo,"
  D'une bouche empruntée au derrière des poules !,Ci baat bu ñu leen di jël ci dugub gàtt yi!
"  J'aime raréfier sur mes pas les saluts,","Ma ngi bëgg a xamal ay yiw ci sama tànk,"
  Et m'écrie avec joie: un ennemi de plus !,"Mu naan: ""Soobaa ngi ci man, te mu ngi ci man, te mu ngi ci man, te mu ngi ci man, te mu ngi ci man, te mu ngi ci man, te mu ngi ci man, te mu ngi ci man, te mu ngi ci man."
LE BRET:,BÉY:
  Quelle aberration !,Lii mooy aberasion!
CYRANO:,CYRANO:
"  Eh bien, oui, c'est mon vice.","Waaw, yaa ngi ma defal."
  Déplaire est mon plaisir. J'aime qu'on me haïsse.,Ma neex na ba ñu bañ ma.
"  Mon cher, si tu savais comme l'on marche mieux","Sëriñ bi, bu nga xam ni ñu gën a dox"
  Sous la pistolétade excitante des yeux !,Ci biir gànnaaw yi neex.
"  Comme, sur les pourpoints, font d'amusantes taches",Ni ñu def ay xët yu neex ci wàllu njàqare yi
  Le fiel des envieux et la bave des lâches !,"Jëf jaay yi, te xëf jaay yi!"
"  --Vous, la molle amitié dont vous vous entourez,","- Yaw, xarit bu baax bi nga wër,"
"  Ressemble à ces grands cols d'Italie, ajourés","Mooy ni ay xeex yu mag yi ci Itali, ñu di ko dàq"
"  Et flottants, dans lesquels votre cou s'effémine:","Te ay xët yuy jàll, ci seen gànnaaw yuy tàbbal."
"  On y est plus à l'aise. . .et de moins haute mine,","Fekk ci loolu, nu gën a rafet."
"  Car le front n'ayant pas de maintien ni de loi,","Ndaxte kanam Yàlla amul yoon, te yoon amul."
"  S'abandonne à pencher dans tous les sens. Mais moi,",Mu ngi bàyyi di tàbbi ci lépp.
"  La Haine, chaque jour, me tuyaute et m'apprête","Xiif-xeef, bés bu nekk, di ma xeex, di ma tàbbi"
  La fraise dont l'empois force à lever la tête;,"Jàmm bi, bi mu xëy, di ko dooleel, mu yéeg boppam."
  Chaque ennemi de plus est un nouveau godron,"Kenn ci kenn ci sunuy xeex, mooy ab xeex bu bees"
"  Qui m'ajoute une gêne, et m'ajoute un rayon:","Mu teg ci ma lu metti, mu teg ci ma lu metti."
"  Car, pareille en tous points à la fraise espagnole,","Ndaxte, ci lépp, mel ni ay xeex yuy Senegaal,"
"  La Haine est un carcan, mais c'est une auréole !","Xiif mooy xiif, waaye mooy xiif!"
"LE BRET (après un silence, passant son bras sous le sien):","BÉY (bu ñu ne ci seen biir, mu ne ci seen biir):"
"  Fais tout haut l'orgueilleux et l'amer, mais, tout bas","Yéen ñiy màgg, di ko yékkati, waaye yékkatileen."
  Dis-moi tout simplement qu'elle ne t'aime pas !,"Waxal ma rekk ne, du la bëgg!"
CYRANO (vivement):,CYRANO (ñii dund):
  Tais-toi !,Bég!
"  (Depuis un moment, Christian est entré, s'est mêlé aux cadets; ceux-ci","(Béy bu mu ko defee, Christian dugg, ànd ak ndaw ya; ñoom"
  ne lui adressent pas la parole; il a fini par s'asseoir seul à une,te bañ a wax ak moom; mu daldi toog ci moom ci benn
